{
  "$schema": "./harness-manifest.schema.json",
  "schema_version": 2,
  "supported_opencode": {
    "minimum": "1.18.4",
    "maximum_exclusive": "1.19.0"
  },
  "defaults": {
    "default_agent": "bx-code",
    "subagent_depth": 1,
    "share": "disabled",
    "autoupdate": false
  },
  "model_binding": {
    "state": "unset",
    "global": {
      "model": null,
      "small_model": null,
      "variant": null
    },
    "agents": {
      "bx-director": null,
      "bx-plan": null,
      "bx-explore": null,
      "bx-code": null,
      "bx-fix": null,
      "bx-test": null,
      "bx-review": null
    }
  },
  "disabled_builtin_agents": [
    "build",
    "explore",
    "general",
    "plan",
    "scout"
  ],
  "agents": [
    {
      "id": "bx-director",
      "mode": "primary",
      "model": null,
      "path": "agents/bx-director.md",
      "sha256": "BC2A2F76E1C15992FB406660FEDBD1E85A3E4BAE843531F8970BF9958E9A20B4"
    },
    {
      "id": "bx-plan",
      "mode": "all",
      "model": null,
      "path": "agents/bx-plan.md",
      "sha256": "389B682D72EC3462805AA93D95DC4A1D78ADBA452A71EDEF068E216CF7425D53"
    },
    {
      "id": "bx-explore",
      "mode": "all",
      "model": null,
      "path": "agents/bx-explore.md",
      "sha256": "B4A62EF9FC363DFB6FA97B9BDA527A90C49B975AD9FCBABAE4BE8A44A4C3211B"
    },
    {
      "id": "bx-code",
      "mode": "all",
      "model": null,
      "path": "agents/bx-code.md",
      "sha256": "68D318BC970B7B4E1DCCAA565211214074E72544E762E1D5F5E53479D0BDD462"
    },
    {
      "id": "bx-fix",
      "mode": "all",
      "model": null,
      "path": "agents/bx-fix.md",
      "sha256": "9A2A2819716470586F894C9296358E1A3689AA7249A76C24A2077D95D5205475"
    },
    {
      "id": "bx-test",
      "mode": "all",
      "model": null,
      "path": "agents/bx-test.md",
      "sha256": "508F6C05246D3D488E4D2EE6B9390D04762367CDFF937686E75A03A2ADD44881"
    },
    {
      "id": "bx-review",
      "mode": "all",
      "model": null,
      "path": "agents/bx-review.md",
      "sha256": "ACE4F9AC8D8DB18C49BD041B76F56347FB9E386F3402AD1A27FF2AAF65BF8BB2"
    }
  ],
  "skills": [
    {
      "id": "conventions",
      "area": "company",
      "status": "skeleton",
      "applies_to": [
        "all"
      ],
      "sources": "organization engineering handbook not supplied",
      "path": "skills/company/conventions/SKILL.md",
      "sha256": "339576E9F4C04DAC68893BD36CED0C8E98165E82AC4FC3E58A6B6B82631A9AC9"
    },
    {
      "id": "definition-of-done",
      "area": "company",
      "status": "ready",
      "applies_to": [
        "all"
      ],
      "sources": "Scrum Guide 2020; Scrum.org Definition of Done and acceptance criteria guidance; BIEXCE evidence-format and review-verdict",
      "path": "skills/company/definition-of-done/SKILL.md",
      "sha256": "47C4C587BBB316C3B573A2D5D0F0B9E65EB95E1582211E3123EC6E90DAD4F07F"
    },
    {
      "id": "git-policy",
      "area": "company",
      "status": "skeleton",
      "applies_to": [
        "bx-director",
        "bx-code",
        "bx-fix",
        "bx-review"
      ],
      "sources": "organization Git governance policy not supplied",
      "path": "skills/company/git-policy/SKILL.md",
      "sha256": "03E350EBD47CB369CE055FEEEBEB363E92D7EE067872A0DF7D4F9E751F2528FC"
    },
    {
      "id": "security-policy",
      "area": "company",
      "status": "ready",
      "applies_to": [
        "all"
      ],
      "sources": "BIEXCE agent role and permission contracts; OWASP ASVS 5.0; OWASP Secrets Management Cheat Sheet",
      "path": "skills/company/security-policy/SKILL.md",
      "sha256": "90B3BADAD9E45353AAEB767A0A0CB5DF6255F0ACC2836597586620B871016FE3"
    },
    {
      "id": "biexce-delivery",
      "area": "core",
      "status": "draft",
      "applies_to": [
        "all bx agents"
      ],
      "sources": "harness 0.3.13 biexce-delivery; MetaGPT SOP chain; github/spec-kit; BMAD-METHOD (chưng cất)",
      "path": "skills/core/biexce-delivery/SKILL.md",
      "sha256": "8424E1DC2CAA305CAFB3780EE3395C629CB2991D07F9EE319623A015EAF30457"
    },
    {
      "id": "codebase-brief",
      "area": "core",
      "status": "ready",
      "applies_to": [
        "bx-explore",
        "bx-plan",
        "bx-director"
      ],
      "sources": "thiết kế Zone A/B Biexce; oh-my-openagent Librarian (ý tưởng, chưng cất)",
      "path": "skills/core/codebase-brief/SKILL.md",
      "sha256": "8D613606EDD50E95779EC48E07426EAC73C3766C3A3E75F06F574BF587DBF4C9"
    },
    {
      "id": "design-discovery",
      "area": "core",
      "status": "ready",
      "applies_to": [
        "bx-director",
        "bx-plan",
        "bx-explore",
        "bx-review"
      ],
      "sources": "obra/superpowers brainstorming; BIEXCE task-spec and Human Gate policy",
      "path": "skills/core/design-discovery/SKILL.md",
      "sha256": "C6EB0F6E13940B018F3C0391527797750C928B54E958D763CE3AE1A6D6409F3F"
    },
    {
      "id": "evidence-format",
      "area": "core",
      "status": "ready",
      "applies_to": [
        "bx-test",
        "bx-fix",
        "bx-code",
        "bx-review",
        "bx-director"
      ],
      "sources": "harness 0.3.x test contract; scorecard benchmark docs cũ",
      "path": "skills/core/evidence-format/SKILL.md",
      "sha256": "8CE9FDB427B6DAF67FE24B47A1690F17CEFA173CAB45DF1E55A166727CE0CC9A"
    },
    {
      "id": "git-flow-ai",
      "area": "core",
      "status": "draft",
      "applies_to": [
        "bx-director",
        "bx-code",
        "bx-fix",
        "bx-review"
      ],
      "sources": "canonical OpenCode permission policy; Pro Git repository inspection guidance",
      "path": "skills/core/git-flow-ai/SKILL.md",
      "sha256": "529B869184991B504331087828FD5599A23E89539173415FD1FDDEC2D046FED9"
    },
    {
      "id": "review-verdict",
      "area": "core",
      "status": "ready",
      "applies_to": [
        "bx-review",
        "bx-director"
      ],
      "sources": "harness 0.3.x review contract; oh-my-openagent hyperplan (red-team, bản rút gọn); VoltAgent code-reviewer (chưng cất)",
      "path": "skills/core/review-verdict/SKILL.md",
      "sha256": "6ADE547481DB81AE216C6808B17F82D56E0402F9DEA13377D309C9D549925FD3"
    },
    {
      "id": "state-beacon",
      "area": "core",
      "status": "ready",
      "applies_to": [
        "bx-director"
      ],
      "sources": "thiết kế nội bộ Biexce (dashboard Mission Control)",
      "path": "skills/core/state-beacon/SKILL.md",
      "sha256": "8171CE2B1D4E2697B41AB565EC2A5CA391E24308604C5D62A39859780453C5A1"
    },
    {
      "id": "systematic-debugging",
      "area": "core",
      "status": "ready",
      "applies_to": [
        "bx-director",
        "bx-code",
        "bx-fix",
        "bx-test",
        "bx-review"
      ],
      "sources": "obra/superpowers systematic-debugging; BIEXCE evidence-format and runtime recovery policy",
      "path": "skills/core/systematic-debugging/SKILL.md",
      "sha256": "F66FA5D223E91D1DCC0D1A308B997436466AEB2052C18EFB2E3E688CE128A046"
    },
    {
      "id": "task-spec",
      "area": "core",
      "status": "ready",
      "applies_to": [
        "bx-director",
        "bx-plan",
        "bx-code",
        "bx-fix",
        "bx-test"
      ],
      "sources": "Anthropic multi-agent lessons (4-part delegation); BMAD story files; github/spec-kit tasks",
      "path": "skills/core/task-spec/SKILL.md",
      "sha256": "B5428E8EB2110831D2E1543B7961AE953EA84A3CE999AD6BC8035ED504EC9800"
    },
    {
      "id": "test-driven-development",
      "area": "core",
      "status": "ready",
      "applies_to": [
        "bx-code",
        "bx-fix",
        "bx-test",
        "bx-review"
      ],
      "sources": "obra/superpowers test-driven-development; BIEXCE unit-integration-e2e and acceptance criteria",
      "path": "skills/core/test-driven-development/SKILL.md",
      "sha256": "6B83851FDE54B20473145E50BFD88FAEE903B060204FDE125BA5FA6EC3B3DBEB"
    },
    {
      "id": "adr",
      "area": "roles/architecture",
      "status": "ready",
      "applies_to": [
        "bx-plan",
        "bx-review"
      ],
      "sources": "AWS Prescriptive Guidance architectural decision records; BMAD-METHOD architecture workflow",
      "path": "skills/roles/architecture/adr/SKILL.md",
      "sha256": "1D016AABC3FC36E27F802DE9A8A0C5D7DF5E1A301A12FDADB8AD9C5AF6E95BE1"
    },
    {
      "id": "api-contract",
      "area": "roles/architecture",
      "status": "ready",
      "applies_to": [
        "bx-plan",
        "bx-review"
      ],
      "sources": "OpenAPI Specification; RFC 9110 HTTP Semantics; RFC 9457 Problem Details; OWASP API Security Top 10 2023",
      "path": "skills/roles/architecture/api-contract/SKILL.md",
      "sha256": "82DECC999CE7BD9AAEA0B4090F313220FA99A3B3DA1731A4268EF25CD1E9D7CD"
    },
    {
      "id": "data-model",
      "area": "roles/architecture",
      "status": "ready",
      "applies_to": [
        "bx-plan",
        "bx-review"
      ],
      "sources": "PostgreSQL current documentation on constraints and indexes; OWASP ASVS; BMAD-METHOD architecture workflow",
      "path": "skills/roles/architecture/data-model/SKILL.md",
      "sha256": "2A22CE24F4938E335A2064B11CD933288F00AAA188CE22F2E7E56A9976747369"
    },
    {
      "id": "system-design",
      "area": "roles/architecture",
      "status": "ready",
      "applies_to": [
        "bx-plan"
      ],
      "sources": "BMAD-METHOD architecture workflow; C4 model official documentation; GitHub Spec Kit plan workflow",
      "path": "skills/roles/architecture/system-design/SKILL.md",
      "sha256": "1265F0C2B78282F2F5E07C61A73A0B4BED5E8E9AED75AB8C4D3C2A0022C06609"
    },
    {
      "id": "abuse-moderation",
      "area": "roles/backend",
      "status": "ready",
      "applies_to": [
        "bx-plan",
        "bx-code",
        "bx-fix",
        "bx-test",
        "bx-review"
      ],